Etudiant;Sujet du stage;Raison sociale;Ville de Stage;Pays de Stage;Tuteur de stage dans l'entreprise;Mail Tuteur de stage dans l'entreprise;Date de debut;Date de fin
;;;;;;;;
;Développement logiciel pour campings dans l'équipe R&D de Sequoiasoft;Sequoiasoft;Lattes;France;;;03/06/2019;16/08/2019
;Implémentation du ball Pivoting en CGAL;AMU -Aix Marseille Université;Marseille;France;;;10/06/2019;10/08/2019
;Amélioration et extension de l'outil de fiabilisation des données;Fatec Group;Marseille;France;;;11/06/2019;23/08/2019
;Développement d'un outil de reporting;Scalian Eurogiciel;Aubagne;France;;;03/06/2019;30/08/2019
;Portage Jeux Vidéo en C/C++;Rush On Game;Marseille;France;;;10/06/2019;10/08/2019
